Page ID,Page name,Disclaimer,Amount spent (THB)
157659344260788,จุรินทร์ ลักษณวิศิษฏ์ Aoodda,Ruthaikan Tanomkerd,≤100
296508406790,"Democrat Party, Thailand พรรคประชาธิปัตย์","Democrat Party, Thailand พรรคประชาธิปัตย์",≤100
161651553861945,Amnesty International Thailand,Amnesty International Thailand,≤100
102807719039442,พรรครวมไทยสร้างชาติ United Thai Nation Party,พรรครวมไทยสร้างชาติ United Thai Nation Party,≤100
100240152175449,ป้าโส FC by Tacina,Dunyawat  Bamrungchan,≤100
105421542338383,ไทม์ ดุลยวัฒน์ - หัวใจสีฟ้า,Dunyawat  Bamrungchan,≤100
104427797605274,ดร.เฉลิมชัย ศรีอ่อน รัฐมนตรีว่าการกระทรวงเกษตรและสหกรณ์,ดร.เฉลิมชัย ศรีอ่อน รัฐมนตรีว่าการกระทรวงเกษตรและสหกรณ์,≤100
279457458842476,InnovestX,These ads ran without a disclaimer,≤100
100530401779420,พรรคไทยภักดี,พรรคไทยภักดี,≤100
105347558390671,นริสสร แสงแก้ว,Attaporn Pohkaew,≤100
368356080442700,กำนันพงษ์ศักดิ์ จ่าแก้ว - คนรักสุราษฎร์,Chadapon Maksuwan,≤100
101535845426970,พรรคไทยสร้างไทย,พรรคไทยสร้างไทย,≤100
345127652279503,มูลนิธิสากลเพื่อคนพิการ,มูลนิธิสากลเพื่อคนพิการ,≤100
1635406246730420,วรงค์ เดชกิจวิกรม - Warong Dechgitvigrom,วรงค์ เดชกิจวิกรม - Warong Dechgitvigrom,≤100
174674890018644,นายเดชอิศม์ ขาวทอง นายกชาย,Phetai Sretrairat,≤100
111341764925564,สำนักสนับสนุนการพัฒนาระบบสุขภาพ - สำนัก 7 สสส.,สำนักสนับสนุนการพัฒนาระบบสุขภาพ - สำนัก 7 สสส.,≤100
102250712237397,สรุปกฎหมาย ก.พ. by Short Note,These ads ran without a disclaimer,≤100
112969264517494,เพ็ญพิสุทธิ์ จินตโสภณ - Penpisut Jintasophon,Vatcharapong Wongkom,≤100
115922723434700,ครูเจพีสรุปย่อ for Teacher,Wimonrat Noyyangdang,≤100
103668907891539,การเมือง Kanmuang,การเมือง Kanmuang,≤100
985820164804495,ธนาคารพัฒนาวิสาหกิจขนาดกลางและขนาดย่อมแห่งประเทศไทย,ธนาคารพัฒนาวิสาหกิจขนาดกลางและขนาดย่อมแห่งประเทศไทย,≤100
190923294988741,สอบครูผู้ช่วยนะ,สอบครูผู้ช่วยนะ,≤100
494189467277672,Agenda,บริษัท ดิ อาเจนด้า จำกัด,≤100
101959916080752,อาจารย์มังตา-มนต์ขลังเขมรชั้นครู,These ads ran without a disclaimer,≤100
114914794432449,กฎหมายใช้สอบราชการ by Æ+,กฎหมายใช้สอบราชการ by Æ+,≤100
234345809961492,ส.ส.จ๋า วชิราภรณ์ กาญจนะ,ส.ส.จ๋า วชิราภรณ์ กาญจนะ,≤100
530945957405983,Nitipon Piwmow - นิติพล ผิวเหมาะ,Nitipon Piwmow,≤100
107612328588715,The Voters,สันติสุข กาญจนประกร,≤100
110256398069518,พิมพ์กาญจน์ กีรติวิราปกรณ์ - Pimkarn Kiratiwirapakorn,Pimkarn Kiratiwirapakorn,≤100
105711950893323,The Modernist,บริษัท โอพีเนียน มีเดีย จำกัด,≤100
256562988507540,Like Anutin,Like Anutin,≤100
567743816917663,The Article,The Article,≤100
294518014039555,With Love by Jamsai,These ads ran without a disclaimer,≤100
110144991464196,กรอบลอยไวนิล แคนวาส บอร์ดไดคัท 99 บาท มีเก็บปลายทาง,Sakawtip Utha,≤100
601953326929372,ธัญวัจน์ กมลวงศ์วัฒน์ - Tunyawaj Kamolwongwat,Tunyawaj Kamolwongwat,≤100
103986582301984,เนื้อ นา บุญ,Phrathanakrit Upachai,≤100
111314055092654,Kaizen,These ads ran without a disclaimer,≤100